{
  "$schema": "https://agent-project-os.org/schemas/dispatch-envelope-v1.schema.json",
  "acceptance_criteria": ["Blocker and next acceptance are explicit"], "assigned_to": "agent:client-pm",
  "created_at": "2026-08-18T00:00:00Z", "dispatch_id": "client-week-34",
  "due_at": "2026-08-18T04:00:00Z", "expected_outputs": ["Bounded child PM report"],
  "issued_by": "agent:pmo", "objective": "Report client adoption blocker",
  "project_id": "client", "protocol_version": "1.0", "status": "issued"
}
