{
  "$schema": "https://agent-project-os.org/schemas/dispatch-envelope-v1.schema.json",
  "acceptance_criteria": ["Report references E2 and E3"], "assigned_to": "agent:service-pm",
  "created_at": "2026-08-18T00:00:00Z", "dispatch_id": "service-week-34",
  "due_at": "2026-08-18T03:00:00Z", "expected_outputs": ["Bounded child PM report"],
  "issued_by": "agent:pmo", "objective": "Reconcile service adoption evidence",
  "project_id": "service", "protocol_version": "1.0", "status": "issued"
}
